title,genres,actor1,actor2,actor3,director,comb
pirates of the caribbean: dead men tell no tales,Adventure,Johnny Depp,Javier Bardem,Geoffrey Rush,Joachim Rønning Espen Sandberg,Johnny Depp Javier Bardem Geoffrey Rush Joachim Rønning Espen Sandberg Adventure
justice league,Action,Ben Affleck,Henry Cavill,Gal Gadot,Zack Snyder,Ben Affleck Henry Cavill Gal Gadot Zack Snyder Action
thor: ragnarok,Action,Chris Hemsworth,Tom Hiddleston,Cate Blanchett,Taika Waititi,Chris Hemsworth Tom Hiddleston Cate Blanchett Taika Waititi Action
guardians of the galaxy vol. 2,Action,Chris Pratt,Zoe Saldana,Dave Bautista,James Gunn,Chris Pratt Zoe Saldana Dave Bautista James Gunn Action
the king's daughter,Fantasy,Pierce Brosnan,William Hurt,Benjamin Walker,Sean McNamara,Pierce Brosnan William Hurt Benjamin Walker Sean McNamara Fantasy
extinction jurassic predators 2017,Thriller,Ben Loyd-Holmes,Sarah Mac,Neil Newbon,Adam Spinks,Ben Loyd-Holmes Sarah Mac Neil Newbon Adam Spinks Thriller
for here or to go?,Drama,Ali Fazal,Melanie Chandra,Omi Vaidya,Rucha Humnabadkar,Ali Fazal Melanie Chandra Omi Vaidya Rucha Humnabadkar Drama
the outcasts,Comedy,Victoria Justice,Eden Sher,Ashley Rickards,Peter Hutchings,Victoria Justice Eden Sher Ashley Rickards Peter Hutchings Comedy
sly cooper,Animation,Chris Murphy,Ian James Corlett,Matt Olsen,Kevin Munroe,Chris Murphy Ian James Corlett Matt Olsen Kevin Munroe Animation
the circle,Drama,Emma Watson,Tom Hanks,John Boyega,James Ponsoldt,Emma Watson Tom Hanks John Boyega James Ponsoldt Drama
pitch perfect 3,Comedy,Anna Kendrick,Rebel Wilson,Brittany Snow,Trish Sie,Anna Kendrick Rebel Wilson Brittany Snow Trish Sie Comedy
the devil's candy,Horror,Ethan Embry,Shiri Appleby,Kiara Glasco,Sean Byrne,Ethan Embry Shiri Appleby Kiara Glasco Sean Byrne Horror
"return to return to nuke 'em high, aka volume 2",Comedy,Asta Paredes,Catherine Corcoran,Zac Amino,Lloyd Kaufman,Asta Paredes Catherine Corcoran Zac Amino Lloyd Kaufman Comedy
the cheerleader murders,TV Movie,Amanda Leighton,Samantha Boscarino,Hannah Kasulka,David Jackson,Amanda Leighton Samantha Boscarino Hannah Kasulka David Jackson TV Movie
dean,Comedy,Demetri Martin,Gillian Jacobs,Christine Woods,Demetri Martin,Demetri Martin Gillian Jacobs Christine Woods Demetri Martin Comedy
leatherface,Horror,Stephen Dorff,Lili Taylor,Sam Strike,Alexandre Bustillo Julien Maury,Stephen Dorff Lili Taylor Sam Strike Alexandre Bustillo Julien Maury Horror
47 meters down,Drama,Claire Holt,Mandy Moore,Chris Johnson,Johannes Roberts,Claire Holt Mandy Moore Chris Johnson Johannes Roberts Drama
porto,Romance,Lucie Lucas,Anton Yelchin,Paulo Calatré,Gabe Klinger,Lucie Lucas Anton Yelchin Paulo Calatré Gabe Klinger Romance
mamaboy,Comedy,Sean O'Donnell,Alexandria DeBerry,Gary Busey,Aaron Leong,Sean O'Donnell Alexandria DeBerry Gary Busey Aaron Leong Comedy
david lynch: the art life,Documentary,,,,Olivia Neergaard-Holm Jon Nguyen Rick Barnes,   Olivia Neergaard-Holm Jon Nguyen Rick Barnes Documentary
the promise,History,Oscar Isaac,Charlotte Le Bon,Christian Bale,Terry George,Oscar Isaac Charlotte Le Bon Christian Bale Terry George History
all eyez on me,Drama,Demetrius Shipp Jr.,Danai Gurira,Kat Graham,Benny Boom,Demetrius Shipp Jr. Danai Gurira Kat Graham Benny Boom Drama
colossal,Action,Anne Hathaway,Jason Sudeikis,Tim Blake Nelson,Nacho Vigalondo,Anne Hathaway Jason Sudeikis Tim Blake Nelson Nacho Vigalondo Action
voyage of time: life's journey,Documentary,,,,Terrence Malick,   Terrence Malick Documentary
london town,Drama,Jonathan Rhys Meyers,Daniel Huttlestone,Dougray Scott,Derrick Borte,Jonathan Rhys Meyers Daniel Huttlestone Dougray Scott Derrick Borte Drama
brimstone,Mystery,Guy Pearce,Dakota Fanning,Carice van Houten,Martin Koolhoven,Guy Pearce Dakota Fanning Carice van Houten Martin Koolhoven Mystery
the white king,Drama,Agyness Deyn,Jonathan Pryce,Fiona Shaw,Alex Helfrecht Jörg Tittel,Agyness Deyn Jonathan Pryce Fiona Shaw Alex Helfrecht Jörg Tittel Drama
risk,Documentary,Julian Assange,Sarah Harrison,Jacob Appelbaum,Laura Poitras,Julian Assange Sarah Harrison Jacob Appelbaum Laura Poitras Documentary
kiki,Documentary,,,,Sara Jordenö,   Sara Jordenö Documentary
shangri-la suite,Romance,Emily Browning,Luke Grimes,Ron Livingston,Eddie O'Keefe,Emily Browning Luke Grimes Ron Livingston Eddie O'Keefe Romance
the space between us,Romance,Asa Butterfield,Britt Robertson,Carla Gugino,Peter Chelsom,Asa Butterfield Britt Robertson Carla Gugino Peter Chelsom Romance
national bird,Documentary,,,,Sonia Kennebeck,   Sonia Kennebeck Documentary
i am not your negro,Documentary,Samuel L. Jackson,James Baldwin,Malcolm X,Raoul Peck,Samuel L. Jackson James Baldwin Malcolm X Raoul Peck Documentary
a dog's purpose,Comedy,Dennis Quaid,Britt Robertson,Josh Gad,Lasse Hallström,Dennis Quaid Britt Robertson Josh Gad Lasse Hallström Comedy
manifesto,Drama,Cate Blanchett,Erika Bauer,Ruby Bustamante,Julian Rosefeldt,Cate Blanchett Erika Bauer Ruby Bustamante Julian Rosefeldt Drama
the little hours,Comedy,Alison Brie,Dave Franco,Aubrey Plaza,Jeff Baena,Alison Brie Dave Franco Aubrey Plaza Jeff Baena Comedy
fist fight,Comedy,Charlie Day,Ice Cube,Tracy Morgan,Richie Keen,Charlie Day Ice Cube Tracy Morgan Richie Keen Comedy
sleepless,Action,Jamie Foxx,Michelle Monaghan,Dermot Mulroney,Baran bo Odar,Jamie Foxx Michelle Monaghan Dermot Mulroney Baran bo Odar Action
a cure for wellness,Mystery,Dane DeHaan,Jason Isaacs,Mia Goth,Gore Verbinski,Dane DeHaan Jason Isaacs Mia Goth Gore Verbinski Mystery
xxx: return of xander cage,Action,Vin Diesel,Ice Cube,Samuel L. Jackson,D.J. Caruso,Vin Diesel Ice Cube Samuel L. Jackson D.J. Caruso Action
the bye bye man,Horror,Douglas Smith,Lucien Laviscount,Cressida Bonas,Stacy Title,Douglas Smith Lucien Laviscount Cressida Bonas Stacy Title Horror
prevenge,Horror,Alice Lowe,Jo Hartley,Kate Dickie,Alice Lowe,Alice Lowe Jo Hartley Kate Dickie Alice Lowe Horror
the lego batman movie,Action,Will Arnett,Zach Galifianakis,Michael Cera,Chris McKay,Will Arnett Zach Galifianakis Michael Cera Chris McKay Action
death race 2050,Action,Manu Bennett,Malcolm McDowell,Marci Miller,G.J. Echternkamp,Manu Bennett Malcolm McDowell Marci Miller G.J. Echternkamp Action
trespass against us,Action,Michael Fassbender,Brendan Gleeson,Lyndsey Marshal,Adam Smith,Michael Fassbender Brendan Gleeson Lyndsey Marshal Adam Smith Action
claire in motion,Drama,Betsy Brandt,Chris Beetem,Zev Haworth,Lisa Robinson Annie J. Howell,Betsy Brandt Chris Beetem Zev Haworth Lisa Robinson Annie J. Howell Drama
coin heist,Family,Alex Saxon,Alexis G. Zall,Sasha Pieterse,Emily Hagins,Alex Saxon Alexis G. Zall Sasha Pieterse Emily Hagins Family
rings,Horror,Matilda Anna Ingrid Lutz,Alex Roe,Johnny Galecki,F. Javier Gutiérrez,Matilda Anna Ingrid Lutz Alex Roe Johnny Galecki F. Javier Gutiérrez Horror
clinical,Thriller,Vinessa Shaw,Kevin Rahm,Aaron Stanford,Alistair Legrand,Vinessa Shaw Kevin Rahm Aaron Stanford Alistair Legrand Thriller
jim gaffigan: cinco,Comedy,,,,Jeannie Gaffigan,   Jeannie Gaffigan Comedy
the crash,Crime,Frank Grillo,Minnie Driver,AnnaSophia Robb,Aram Rappaport,Frank Grillo Minnie Driver AnnaSophia Robb Aram Rappaport Crime
get out,Mystery,Daniel Kaluuya,Allison Williams,Bradley Whitford,Jordan Peele,Daniel Kaluuya Allison Williams Bradley Whitford Jordan Peele Mystery
kong: skull island,Action,Tom Hiddleston,Samuel L. Jackson,Brie Larson,Jordan Vogt-Roberts,Tom Hiddleston Samuel L. Jackson Brie Larson Jordan Vogt-Roberts Action
city of tiny lights,Crime,Riz Ahmed,Billie Piper,James Floyd,Pete Travis,Riz Ahmed Billie Piper James Floyd Pete Travis Crime
t2 trainspotting,Crime,Ewan McGregor,Jonny Lee Miller,Ewen Bremner,Danny Boyle,Ewan McGregor Jonny Lee Miller Ewen Bremner Danny Boyle Crime
science fiction volume one: the osiris child,Sci-Fi,Kellan Lutz,Daniel MacPherson,Isabel Lucas,Shane Abbess,Kellan Lutz Daniel MacPherson Isabel Lucas Shane Abbess Sci-Fi
before i fall,Mystery,Zoey Deutch,Halston Sage,Logan Miller,Ry Russo-Young,Zoey Deutch Halston Sage Logan Miller Ry Russo-Young Mystery
the big sick,Comedy,Kumail Nanjiani,Zoe Kazan,Holly Hunter,Michael Showalter,Kumail Nanjiani Zoe Kazan Holly Hunter Michael Showalter Comedy
ingrid goes west,Drama,Aubrey Plaza,Elizabeth Olsen,O'Shea Jackson Jr.,Matt Spicer,Aubrey Plaza Elizabeth Olsen O'Shea Jackson Jr. Matt Spicer Drama
i don't feel at home in this world anymore,Comedy,Melanie Lynskey,Elijah Wood,David Yow,Macon Blair,Melanie Lynskey Elijah Wood David Yow Macon Blair Comedy
king arthur: legend of the sword,Action,Charlie Hunnam,Astrid Bergès-Frisbey,Jude Law,Guy Ritchie,Charlie Hunnam Astrid Bergès-Frisbey Jude Law Guy Ritchie Action
beauty and the beast,Family,Emma Watson,Dan Stevens,Luke Evans,Bill Condon,Emma Watson Dan Stevens Luke Evans Bill Condon Family
take the 10,Comedy,Stella Maeve,Andy Samberg,Josh Peck,Chester Tam,Stella Maeve Andy Samberg Josh Peck Chester Tam Comedy
the boss baby,Animation,Alec Baldwin,Miles Bakshi,Jimmy Kimmel,Tom McGrath,Alec Baldwin Miles Bakshi Jimmy Kimmel Tom McGrath Animation
justice league dark,Action,Matt Ryan,Jason O'Mara,Camilla Luddington,Jay Oliva,Matt Ryan Jason O'Mara Camilla Luddington Jay Oliva Action
call me by your name,Romance,Timothée Chalamet,Armie Hammer,Michael Stuhlbarg,Luca Guadagnino,Timothée Chalamet Armie Hammer Michael Stuhlbarg Luca Guadagnino Romance
iboy,Action,Bill Milner,Maisie Williams,Rory Kinnear,Adam Randall,Bill Milner Maisie Williams Rory Kinnear Adam Randall Action
catfight,Comedy,Sandra Oh,Anne Heche,Alicia Silverstone,Onur Tukel,Sandra Oh Anne Heche Alicia Silverstone Onur Tukel Comedy
a ghost story,Drama,Casey Affleck,Rooney Mara,Will Oldham,David Lowery,Casey Affleck Rooney Mara Will Oldham David Lowery Drama
ghost in the shell,Action,Scarlett Johansson,Michael Pitt,Pilou Asbæk,Rupert Sanders,Scarlett Johansson Michael Pitt Pilou Asbæk Rupert Sanders Action
pork pie,Action,Dean O'Gorman,James Rolleston,Ashleigh Cummings,Matt Murphy,Dean O'Gorman James Rolleston Ashleigh Cummings Matt Murphy Action
bill burr: walk your way out,Comedy,,,,Jay Karas,   Jay Karas Comedy
xx,Horror,Natalie Brown,Melanie Lynskey,Breeda Wool,Karyn Kusama Jovanka Vuckovic Roxanne Benjamin St. Vincent,Natalie Brown Melanie Lynskey Breeda Wool Karyn Kusama Jovanka Vuckovic Roxanne Benjamin St. Vincent Horror
fifty shades darker,Drama,Dakota Johnson,Jamie Dornan,Eric Johnson,James Foley,Dakota Johnson Jamie Dornan Eric Johnson James Foley Drama
wilson,Drama,Woody Harrelson,Sandy Oian-Thomas,Shaun Brown,Craig Johnson,Woody Harrelson Sandy Oian-Thomas Shaun Brown Craig Johnson Drama
don't knock twice,Horror,Katee Sackhoff,Lucy Boynton,Javier Botet,Caradog W. James,Katee Sackhoff Lucy Boynton Javier Botet Caradog W. James Horror
the ticket,Drama,Dan Stevens,Malin Åkerman,Kerry Bishé,Ido Fluk,Dan Stevens Malin Åkerman Kerry Bishé Ido Fluk Drama
lavender,Drama,Abbie Cornish,Dermot Mulroney,Diego Klattenhoff,Ed Gass-Donnelly,Abbie Cornish Dermot Mulroney Diego Klattenhoff Ed Gass-Donnelly Drama
detour,Thriller,Tye Sheridan,Bel Powley,Emory Cohen,Christopher Smith,Tye Sheridan Bel Powley Emory Cohen Christopher Smith Thriller
the book of love,Drama,Jason Sudeikis,Maisie Williams,Jessica Biel,Bill Purple,Jason Sudeikis Maisie Williams Jessica Biel Bill Purple Drama
trumped: inside the greatest political upset of all time,Documentary,,,,Banks Tarver Ted Bourne Mary Robertson,   Banks Tarver Ted Bourne Mary Robertson Documentary
hickey,Comedy,Troy Doherty,Flavia Watson,Raychel Diane Weiner,Alex Grossman,Troy Doherty Flavia Watson Raychel Diane Weiner Alex Grossman Comedy
neal brennan: 3 mics,Comedy,,,,Neal Brennan,   Neal Brennan Comedy
"michael bolton's big, sexy valentine's day special",Comedy,Michael Bolton,Adam Scott,Sarah Shahi,Akiva Schaffer Scott Aukerman,Michael Bolton Adam Scott Sarah Shahi Akiva Schaffer Scott Aukerman Comedy
lost in florence,Adventure,Brett Dalton,Emily Atack,Stana Katic,Evan Oppenheimer,Brett Dalton Emily Atack Stana Katic Evan Oppenheimer Adventure
bad kids of crestview academy,Mystery,Gina Gershon,Sean Astin,Sammi Hanratty,Ben Browder,Gina Gershon Sean Astin Sammi Hanratty Ben Browder Mystery
shepherds and butchers,Drama,Andrea Riseborough,Steve Coogan,Deon Lotz,Oliver Schmitz,Andrea Riseborough Steve Coogan Deon Lotz Oliver Schmitz Drama
in dubious battle,Drama,James Franco,Nat Wolff,Selena Gomez,James Franco,James Franco Nat Wolff Selena Gomez James Franco Drama
berlin syndrome,Mystery,Teresa Palmer,Max Riemelt,Matthias Habich,Cate Shortland,Teresa Palmer Max Riemelt Matthias Habich Cate Shortland Mystery
all this panic,Documentary,Dusty Rose Ryan,Lena M.,Ginger Leigh Ryan,Jenny Gage,Dusty Rose Ryan Lena M. Ginger Leigh Ryan Jenny Gage Documentary
youth in oregon,Comedy,Frank Langella,Billy Crudup,Christina Applegate,Joel David Moore,Frank Langella Billy Crudup Christina Applegate Joel David Moore Comedy
song to song,Drama,Michael Fassbender,Ryan Gosling,Rooney Mara,Terrence Malick,Michael Fassbender Ryan Gosling Rooney Mara Terrence Malick Drama
to the bone,Drama,Lily Collins,Carrie Preston,Lili Taylor,Marti Noxon,Lily Collins Carrie Preston Lili Taylor Marti Noxon Drama
girlfriend's day,Comedy,Bob Odenkirk,Amber Tamblyn,Natasha Lyonne,Michael Stephenson,Bob Odenkirk Amber Tamblyn Natasha Lyonne Michael Stephenson Comedy
american fable,Drama,Peyton Kennedy,Richard Schiff,Kip Pardue,Anne Hamilton,Peyton Kennedy Richard Schiff Kip Pardue Anne Hamilton Drama
katherine ryan: in trouble,Comedy,,,,Colin Dench,   Colin Dench Comedy
god's own country,Romance,Josh O'Connor,Alec Secareanu,Ian Hart,Francis Lee,Josh O'Connor Alec Secareanu Ian Hart Francis Lee Romance
hostages,Drama,Irakli Kvirikadze,Tinatin Dalakishvili,Merab Ninidze,Rezo Gigineishvili,Irakli Kvirikadze Tinatin Dalakishvili Merab Ninidze Rezo Gigineishvili Drama
lovesong,Drama,Jena Malone,Riley Keough,Jessie Ok Gray,So Yong Kim,Jena Malone Riley Keough Jessie Ok Gray So Yong Kim Drama
jen kirkman: just keep livin',Comedy,,,,Lance Bangs,   Lance Bangs Comedy
becoming warren buffett,Documentary,Warren Buffett,Susan Buffett,Bill Gates,Peter W. Kunhardt Brian Oakes,Warren Buffett Susan Buffett Bill Gates Peter W. Kunhardt Brian Oakes Documentary
everybody loves somebody,Romance,Karla Souza,José María Yazpik,Ben O'Toole,Catalina Aguilar Mastretta,Karla Souza José María Yazpik Ben O'Toole Catalina Aguilar Mastretta Romance
britney ever after,Drama,Natasha Bassett,Jenna Berman,Matthew Harrison,Leslie Libman,Natasha Bassett Jenna Berman Matthew Harrison Leslie Libman Drama
"nick cannon: stand up, don't shoot",Comedy,,,,Gil Cunha,   Gil Cunha Comedy
fair haven,Family,Tom Wopat,Michael Grant,Gregory Harrison,Kerstin Karlhuber,Tom Wopat Michael Grant Gregory Harrison Kerstin Karlhuber Family
oklahoma city,Documentary,,,,Barak Goodman,   Barak Goodman Documentary
the glass castle,Drama,Brie Larson,Woody Harrelson,Naomi Watts,Destin Cretton,Brie Larson Woody Harrelson Naomi Watts Destin Cretton Drama
fare,Drama,Thomas Torrey,Katherine Drew,J.R. Adduci,Thomas Torrey,Thomas Torrey Katherine Drew J.R. Adduci Thomas Torrey Drama
tom of finland,Drama,Pekka Strang,Lauri Tilkanen,Jakob Oftebro,Dome Karukoski,Pekka Strang Lauri Tilkanen Jakob Oftebro Dome Karukoski Drama
donald cried,Drama,Louisa Krause,Allie Marshall,Ariana DeFusco,Kris Avedisian,Louisa Krause Allie Marshall Ariana DeFusco Kris Avedisian Drama
zombie pizza,Horror,Rachel Barrer,Gleb Kaminer,Shaun Rey,Mike Dudko,Rachel Barrer Gleb Kaminer Shaun Rey Mike Dudko Horror
their finest,Romance,Gemma Arterton,Sam Claflin,Bill Nighy,Lone Scherfig,Gemma Arterton Sam Claflin Bill Nighy Lone Scherfig Romance
the ottoman lieutenant,Romance,Michiel Huisman,Hera Hilmar,Josh Hartnett,Joseph Ruben,Michiel Huisman Hera Hilmar Josh Hartnett Joseph Ruben Romance
lady macbeth,Drama,Florence Pugh,Cosmo Jarvis,Paul Hilton,William Oldroyd,Florence Pugh Cosmo Jarvis Paul Hilton William Oldroyd Drama
the sense of an ending,Mystery,Jim Broadbent,Charlotte Rampling,Harriet Walter,Ritesh Batra,Jim Broadbent Charlotte Rampling Harriet Walter Ritesh Batra Mystery
carrie pilby,Drama,Bel Powley,Nathan Lane,Gabriel Byrne,Susan Johnson,Bel Powley Nathan Lane Gabriel Byrne Susan Johnson Drama
the institute,Thriller,James Franco,Tim Blake Nelson,Lori Singer,James Franco Pamela Romanowsky,James Franco Tim Blake Nelson Lori Singer James Franco Pamela Romanowsky Thriller
the shack,Drama,Sam Worthington,Octavia Spencer,Tim McGraw,Stuart Hazeldine,Sam Worthington Octavia Spencer Tim McGraw Stuart Hazeldine Drama
life,Horror,Jake Gyllenhaal,Rebecca Ferguson,Ryan Reynolds,Daniel Espinosa,Jake Gyllenhaal Rebecca Ferguson Ryan Reynolds Daniel Espinosa Horror
the raking,Horror,Cree Kelly,Allie Rivera,Thatcher Robinson,Bryan Brewer,Cree Kelly Allie Rivera Thatcher Robinson Bryan Brewer Horror
sleight,Drama,Jacob Latimore,Seychelle Gabriel,Sasheer Zamata,J.D. Dillard,Jacob Latimore Seychelle Gabriel Sasheer Zamata J.D. Dillard Drama
kurt braunohler: trust me,Comedy,,,,Shannon Hartman,   Shannon Hartman Comedy
buster's mal heart,Mystery,Rami Malek,DJ Qualls,Kate Lyn Sheil,Sarah Adina Smith,Rami Malek DJ Qualls Kate Lyn Sheil Sarah Adina Smith Mystery
ghosts of darkness,Horror,Michael Koltes,Paul Flannery,Lisa Livingstone,David Ryan Keith,Michael Koltes Paul Flannery Lisa Livingstone David Ryan Keith Horror
power rangers,Action,Dacre Montgomery,Naomi Scott,RJ Cyler,Dean Israelite,Dacre Montgomery Naomi Scott RJ Cyler Dean Israelite Action
alien: covenant,Horror,Michael Fassbender,Katherine Waterston,Billy Crudup,Ridley Scott,Michael Fassbender Katherine Waterston Billy Crudup Ridley Scott Horror
free fire,Action,Sharlto Copley,Armie Hammer,Brie Larson,Ben Wheatley,Sharlto Copley Armie Hammer Brie Larson Ben Wheatley Action
casting jonbenet,Documentary,Hannah Cagwin,Aeona Cruz,Liv Bagley,Kitty Green,Hannah Cagwin Aeona Cruz Liv Bagley Kitty Green Documentary
amy schumer: the leather special,Comedy,,,,Amy Schumer,   Amy Schumer Comedy
the dinner,Drama,Richard Gere,Laura Linney,Steve Coogan,Oren Moverman,Richard Gere Laura Linney Steve Coogan Oren Moverman Drama
the avenue,Crime,Cheryl M. Bailey,Louis Ballezzi,Shawn Bittenbender,Brian Vernick,Cheryl M. Bailey Louis Ballezzi Shawn Bittenbender Brian Vernick Crime
arsenal,Action,Nicolas Cage,Christopher Rob Bowen,Adrian Grenier,Steven C. Miller,Nicolas Cage Christopher Rob Bowen Adrian Grenier Steven C. Miller Action
jim norton: mouthful of shame,Comedy,,,,Shannon Hartman,   Shannon Hartman Comedy
from straight a's to xxx,Drama,Haley Pullos,Judd Nelson,Sasha Clements,Vanessa Parise,Haley Pullos Judd Nelson Sasha Clements Vanessa Parise Drama
the invisible guardian,Thriller,Marta Etura ,Elvira Mínguez,Francesc Orella,Fernando González Molina,Marta Etura  Elvira Mínguez Francesc Orella Fernando González Molina Thriller
gemini,Thriller,Lola Kirke,Zoë Kravitz,John Cho,Aaron Katz,Lola Kirke Zoë Kravitz John Cho Aaron Katz Thriller
trevor noah: afraid of the dark,Comedy,,,,David Paul Meyer,   David Paul Meyer Comedy
dave chappelle: the age of spin,Comedy,,,,Stan Lathan,   Stan Lathan Comedy
david bowie: the last five years,Music,Tony Visconti,Gail Ann Dorsey,Tony Basil,Francis Whately,Tony Visconti Gail Ann Dorsey Tony Basil Francis Whately Music
the evil within,Horror,Fred Koehler,Sean Patrick Flanery,Brianna Brown,Andrew Getty,Fred Koehler Sean Patrick Flanery Brianna Brown Andrew Getty Horror
the last word,Comedy,Shirley MacLaine,Amanda Seyfried,Anne Heche,Mark Pellington,Shirley MacLaine Amanda Seyfried Anne Heche Mark Pellington Comedy
chips,Action,Michael Peña,Dax Shepard,Jessica McNamee,Dax Shepard,Michael Peña Dax Shepard Jessica McNamee Dax Shepard Action
table 19,Comedy,Anna Kendrick,Craig Robinson,June Squibb,Jeffrey Blitz,Anna Kendrick Craig Robinson June Squibb Jeffrey Blitz Comedy
going in style,Crime,Morgan Freeman,Michael Caine,Alan Arkin,Zach Braff,Morgan Freeman Michael Caine Alan Arkin Zach Braff Crime
bokeh,Drama,Maika Monroe,Matt O'Leary,Arnar Jónsson,Geoffrey Orthwein Andrew Sullivan,Maika Monroe Matt O'Leary Arnar Jónsson Geoffrey Orthwein Andrew Sullivan Drama
dave chappelle: deep in the heart of texas,Comedy,,,,Stan Lathan,   Stan Lathan Comedy
all nighter,Comedy,J.K. Simmons,Analeigh Tipton,Emile Hirsch,Gavin Wiesen,J.K. Simmons Analeigh Tipton Emile Hirsch Gavin Wiesen Comedy
deidra & laney rob a train,Drama,Ashleigh Murray,Rachel Crow,Tim Blake Nelson,Sydney Freeland,Ashleigh Murray Rachel Crow Tim Blake Nelson Sydney Freeland Drama
carnage: swallowing the past,Sci-Fi,Simon Amstell,Linda Bassett,Martin Freeman,Simon Amstell,Simon Amstell Linda Bassett Martin Freeman Simon Amstell Sci-Fi
the most hated woman in america,Crime,Melissa Leo,Josh Lucas,Michael Chernus,Tommy O'Haver,Melissa Leo Josh Lucas Michael Chernus Tommy O'Haver Crime
bitter harvest,War,Max Irons,Samantha Barks,Terence Stamp,George Mendeluk,Max Irons Samantha Barks Terence Stamp George Mendeluk War
vengeance: a love story,Action,Nicolas Cage,Deborah Kara Unger,Anna Hutchison,Johnny Martin,Nicolas Cage Deborah Kara Unger Anna Hutchison Johnny Martin Action
middle man,Drama,Jim O'Heir,Andrew J. West,Josh McDermitt,Ned Crowley,Jim O'Heir Andrew J. West Josh McDermitt Ned Crowley Drama
miles,Drama,Tim Boardman,Missi Pyle,Stephen Root,Nathan Adloff,Tim Boardman Missi Pyle Stephen Root Nathan Adloff Drama
smurfs: the lost village,Adventure,Julia Roberts,Ariel Winter,Ellie Kemper,Kelly Asbury,Julia Roberts Ariel Winter Ellie Kemper Kelly Asbury Adventure
the discovery,Drama,Jason Segel,Rooney Mara,Robert Redford,Charlie McDowell,Jason Segel Rooney Mara Robert Redford Charlie McDowell Drama
viceroy's house,Drama,Hugh Bonneville,Gillian Anderson,Michael Gambon,Gurinder Chadha,Hugh Bonneville Gillian Anderson Michael Gambon Gurinder Chadha Drama
the zookeeper's wife,Drama,Jessica Chastain,Johan Heldenbergh,Daniel Brühl,Niki Caro,Jessica Chastain Johan Heldenbergh Daniel Brühl Niki Caro Drama
female fight club,Drama,Amy Johnston,Cortney Palm,Rey Goyos,Miguel A. Ferrer,Amy Johnston Cortney Palm Rey Goyos Miguel A. Ferrer Drama
eloise,Horror,Eliza Dushku,Robert Patrick,Chace Crawford,Robert Legato,Eliza Dushku Robert Patrick Chace Crawford Robert Legato Horror
gifted,Drama,Chris Evans,Mckenna Grace,Lindsay Duncan,Marc Webb,Chris Evans Mckenna Grace Lindsay Duncan Marc Webb Drama
teen titans: the judas contract,Sci-Fi,Stuart Allan,Jake T. Austin,Taissa Farmiga,Sam Liu,Stuart Allan Jake T. Austin Taissa Farmiga Sam Liu Sci-Fi
louis c.k. 2017,Comedy,,,,Louis C.K.,   Louis C.K. Comedy
aftermath,Drama,Arnold Schwarzenegger,Scoot McNairy,Maggie Grace,Elliott Lester,Arnold Schwarzenegger Scoot McNairy Maggie Grace Elliott Lester Drama
the bigfoot project,Comedy,Andy Goldenberg,Emily Roya O'Brien,Nick Armstrong,Ricardo Herrera,Andy Goldenberg Emily Roya O'Brien Nick Armstrong Ricardo Herrera Comedy
the case for christ,Drama,Mike Vogel,Erika Christensen,Faye Dunaway,Jon Gunn,Mike Vogel Erika Christensen Faye Dunaway Jon Gunn Drama
1 mile to you,Drama,Graham Rogers,Billy Crudup,Liana Liberato,Leif Tilden,Graham Rogers Billy Crudup Liana Liberato Leif Tilden Drama
spark: a space tail,Adventure,Jessica Biel,Hilary Swank,Susan Sarandon,Aaron Woodley,Jessica Biel Hilary Swank Susan Sarandon Aaron Woodley Adventure
"everything, everything",Drama,Amandla Stenberg,Nick Robinson,Anika Noni Rose,Stella Meghie,Amandla Stenberg Nick Robinson Anika Noni Rose Stella Meghie Drama
diary of a wimpy kid: the long haul,Comedy,Jason Ian Drucker,Owen Asztalos,Charlie Wright,David Bowers,Jason Ian Drucker Owen Asztalos Charlie Wright David Bowers Comedy
baywatch,Action,Dwayne Johnson,Zac Efron,Alexandra Daddario,Seth Gordon,Dwayne Johnson Zac Efron Alexandra Daddario Seth Gordon Action
unforgettable,Drama,Rosario Dawson,Katherine Heigl,Geoff Stults,Denise Di Novi,Rosario Dawson Katherine Heigl Geoff Stults Denise Di Novi Drama
snatched,Action,Amy Schumer,Goldie Hawn,Tom Bateman,Jonathan Levine,Amy Schumer Goldie Hawn Tom Bateman Jonathan Levine Action
the mummy,Thriller,Tom Cruise,Russell Crowe,Annabelle Wallis,Alex Kurtzman,Tom Cruise Russell Crowe Annabelle Wallis Alex Kurtzman Thriller
from a house on willow street,Action,Sharni Vinson,Carlyn Burchell,Steve John Ward,Alastair Orr,Sharni Vinson Carlyn Burchell Steve John Ward Alastair Orr Action
the fate of the furious,Action,Vin Diesel,Jason Statham,Dwayne Johnson,F. Gary Gray,Vin Diesel Jason Statham Dwayne Johnson F. Gary Gray Action
after porn ends 2,Documentary,Ginger Lynn Allen,Lisa Ann,Janine Lindemulder,Bryce Wagoner,Ginger Lynn Allen Lisa Ann Janine Lindemulder Bryce Wagoner Documentary
burning sands,Drama,Trevor Jackson,Alfre Woodard,Steve Harris,Gerard McMurray,Trevor Jackson Alfre Woodard Steve Harris Gerard McMurray Drama
teleios,Sci-Fi,Sunny Mabrey,Lance Broadway,T.J. Hoban,Ian Truitner,Sunny Mabrey Lance Broadway T.J. Hoban Ian Truitner Sci-Fi
sandy wexler,Comedy,Adam Sandler,Kevin James,Terry Crews,Steven Brill,Adam Sandler Kevin James Terry Crews Steven Brill Comedy
extortion,Action,Bethany Joy Lenz,Danny Glover,Tim Griffin,Phil Volken,Bethany Joy Lenz Danny Glover Tim Griffin Phil Volken Action
betting on zero,Documentary,,,,Ted Braun,   Ted Braun Documentary
the transfiguration,Horror,Eric Ruffin,Chloe Levine,Aaron Moten,Michael O'Shea,Eric Ruffin Chloe Levine Aaron Moten Michael O'Shea Horror
another evil,Comedy,Steve Zissis,Mark Proksch,Jennifer Irwin,Carson D. Mell,Steve Zissis Mark Proksch Jennifer Irwin Carson D. Mell Comedy
win it all,Comedy,Jake Johnson,Aislinn Derbez,Joe Lo Truglio,Joe Swanberg,Jake Johnson Aislinn Derbez Joe Lo Truglio Joe Swanberg Comedy
captain underpants: the first epic movie,Action,Kevin Hart,Ed Helms,Thomas Middleditch,David Soren,Kevin Hart Ed Helms Thomas Middleditch David Soren Action
band aid,Comedy,Zoe Lister-Jones,Adam Pally,Fred Armisen,Zoe Lister-Jones,Zoe Lister-Jones Adam Pally Fred Armisen Zoe Lister-Jones Comedy
